{
  "arn": "arn:aws:devicefarm:us-west-2:123456789012:project:abc123",
  "name": "Example name",
  "type": "BUILTIN_FUZZ",
  "created": "example-created",
  "status": "COMPLETED",
  "result": "PASSED",
  "started": "example-started",
  "stopped": "example-stopped",
  "counters": "example-counters",
  "message": "An example message",
  "device": "example-device",
  "instanceArn": "arn:aws:devicefarm:us-west-2:123456789012:project:abc123",
  "deviceMinutes": "example-deviceMinutes",
  "videoEndpoint": "example-videoEndpoint",
  "videoCapture": "example-videoCapture"
}